{
  "id": "12345",
  "monitorPlanId": "12345",
  "reportFrequencyCode": "string",
  "beginReportPeriodId": 0.0,
  "endReportPeriodId": 0.0,
  "userId": "12345",
  "addDate": "2024-01-15T12:00:00Z",
  "updateDate": "2024-01-15T12:00:00Z",
  "plan": "example",
  "beginReportingPeriod": "example",
  "endReportingPeriod": "example"
}